name,demand,capacity,latency,risk,weight,score,decision,reason
baseline,65,90,18,14,8,90,review,mobile workflows baseline scenario exercises the review path for bounded failure handling
pressure,83,73,26,20,8,35,review,mobile workflows pressure scenario exercises the review path for bounded failure handling
surge,106,98,18,16,14,196,accept,mobile workflows surge scenario keeps the local fixture within the modeled acceptance band
degraded,63,63,34,24,8,-75,review,mobile workflows degraded scenario exercises the review path for bounded failure handling
recovery,88,102,18,10,12,196,accept,mobile workflows recovery scenario keeps the local fixture within the modeled acceptance band
boundary,72,79,24,15,7,57,review,mobile workflows boundary scenario exercises the review path for bounded failure handling
